body,title,url
"El mundo y sus esferas educativas, laborales, sociales y culturales cambian cada día. Hoy, cuando gran parte de la sociedad transcurre en un contexto de incertidumbre y nuevas dinámicas por cuenta de la pandemia de la COVID-19, hay que tener claro que la transformación digital ya es una realidad en muchos ámbitos; de ahí la necesidad de la capacitación y actualización constantes como principio de vida. En lo que a educación respecta, tan solo en Colombia más de 9.000 instituciones oficiales, 329.000 docentes y directivos, y cerca de diez millones de estudiantes se han visto abocados a hacer cambios en sus vidas para mantener la continuidad de sus procesos de aprendizaje.","Si tiene acceso a Internet, las competencias TIC están a un solo clic",https://www.eltiempo.com//contenido-comercial/si-tiene-acceso-a-internet-las-competencias-tic-estan-a-un-solo-clic-510640
"A diario, cientos de peatones transitan por las calles y avenidas de las ciudades, a veces sin percatarse de detalles que fueron pensados a través de un trabajo conjunto entre arquitectos, urbanistas, paisajistas, ingenieros, diseñadores, entre otros, para que las personas tengan una mejor calidad de vida.","Arquitectour II, ventana abierta a las tendencias de construcción",https://www.eltiempo.com//economia/arquitectour-ii-ventana-abierta-a-las-tendencias-de-construccion-512046
"Ante el proyecto del gobierno israelí del 'premier' Benjamin Netanyahu de anexionarse partes de Cisjordania ocupada, que podría ser implementado a partir del 1º. de julio, EL TIEMPO habló con el negociador palestino Saeb Erekat, a través de una rueda de prensa virtual,  y con el general (r) Danny Yatom, exjefe del Mossad y otrora secretario militar del asesinado primer ministro israelí Yitzhak Rabin.(Lea también:  ONU advierte a Israel sobre plan de anexión de partes de Cisjordania).","Anexión de parte de Cisjordania, el gran desafío de Netanyahu al mundo",https://www.eltiempo.com//mundo/medio-oriente/posiciones-de-sobre-el-plan-de-netanyahu-para-anexion-de-una-parte-de-cisjordania-511884
"Luego de que varias personas denunciaran en redes sociales que el Ejército, al parecer, disparó y causó la muerte un líder joven comunal en Teorama, Norte de Santander, el Ejército respondió en un comunicado sobre los hechos.",Ejército responde a denuncias de asesinato de líder en Teorama,https://www.eltiempo.com//justicia/delitos/ejercito-responde-a-denuncias-de-asesinato-de-lider-social-en-teorama-512060
"Aunque la esclavitud se abolió en el siglo XIX, sigue desfigurando el mundo. En lo que llevamos del XXI se han hecho infinidad de descubrimientos y logrado avances científicos significativos, pero no se ha extirpado este basilisco que se multiplica y arrastra como la peor, más venenosa y fulminante de las víboras.",Esclavitud moderna: 40 millones son víctimas del mercado de la infamia,https://www.eltiempo.com//mundo/esclavitud-moderna-en-2020-511758
"El domingo pasado, sobre las cinco de la tarde, una menor de edad de la comunidad embera chamí salió de su casa, en pleno día de mercado, para conseguir unas frutas y no regresó a su vivienda. Al día siguiente fue encontrada sola y llorando cerca del río que pasa por la vereda Santa Cecilia, en el municipio de Pueblo Rico, Risaralda.Una semana después, la menor, que fue violada por un grupo de soldados que prestaban su servicio en el Batallón San Mateo, está bajo protección del Bienestar Familiar en Pereira, parte de su familia tuvo que dejar su casa en Pueblo Rico para acompañarla y apoyarla en la capital del departamento, y siete militares están privados de su libertad en una unidad militar mientras esperan una condena de hasta 30 años de cárcel por su responsabilidad en el atroz hecho.",Las horas claves del caso por violación de niña embera por soldados,https://www.eltiempo.com/justicia/delitos/que-se-sabe-y-que-sigue-en-caso-de-nina-indigena-violada-por-soldados-del-ejercito-511918
"Bajo el desenfreno de la noche del pasado domingo, del cuarto piso de una casa arrojaron un gato, en el barrio El Retiro de Cali. En la caída, el animal salió con fracturas en una de sus patas.En redes, Sandra Astaiza contó ese acto violento que algunos comentaristas equipararon al de un militar que lanzó un perro en una zona rural de Nariño.Y Liliana Londoño contaba la historia de una mascota embarazada abandonada.",Ni los animales se salvan de la violencia durante cuarentena en Cali,https://www.eltiempo.com//colombia/cali/maltrato-animal-en-cali-durante-la-cuarentena-por-covid-19-512098
"La Fiscalía General de la Nación abrió una investigación penal por los hechos que rodearon la muerte del adolescente Duván Álvarez durante el desalojo de un predio, el pasado jueves 25 de junio, en el barrio Ciudadela Sucre, Comuna Cuatro de Soacha, Cundinamarca. Según denuncias en redes sociales, el hecho sucedió mientras el Escuadrón Móvil Antidisturbios (Esmad) realizaba el desalojo por la ocupación ilegal de un predio de un privado, personas han expresado que en ese momento, algunos miembros de la policía realizaron disparos que impactaron al menor de edad en el tórax.",Fiscalía investiga muerte de joven durante desalojo en Soacha,https://www.eltiempo.com//justicia/delitos/fiscalia-investiga-muerte-de-joven-durante-desalojos-en-soacha-512108
"Hay efemérides que al mirarlas y comparar el presente con el pasado pareciera como si nada hubiera cambiado. Sin embargo, cuando se miran en detalle ciertas circunstancias en realidad los avances son enormes, pero los esfuerzos que aún quedan por hacer son titánicos. Este es uno de esos casos. ",Estudio resalta las series y películas LGBTQ+ de Netflix,https://www.eltiempo.com//cultura/series-de-netflix-sobre-la-comunidad-lgbtq-para-ver-en-el-dia-del-orgullo-511898
"Tras su explosivo arranque en la provincia de Wuhan, en China, el año pasado, y mientras asolaba Europa, donde lleva cerca de 200.000 muertos, la pandemia del covid-19 atravesó el Atlántico en febrero. Durante las primeras semanas, en América los números subieron con lentitud: varios países –entre ellos Colombia– impusieron severas cuarentenas para ralentizar el avance del coronavirus y evitar que semejante mortandad se repitiera en estos lares.",,https://www.eltiempo.com//opinion/columnistas/mauricio-vargas/desconcierto-columna-de-mauricio-vargas-511988
"El celular es una de las herramientas más importantes de cualquier persona en la actualidad; ya sea para entretenerse, estar conectado con sus seres queridos o trabajar. Es difícil pensar en la vida sin un dispositivo que reúna todas estas características en un pequeño cuerpo metálico (o de plástico). Y, aunque la tendencia de uso de los celulares venía en aumento, desde que se inició la cuarentena se ha visto un crecimiento exponencial del tiempo que se está conectado.","Celular para teletrabajo, más que un dispositivo para recibir llamadas",https://www.eltiempo.com//tecnosfera/novedades-tecnologia/aplicaciones-y-funciones-del-celular-que-lo-haran-mas-productivo-512096
"Aprendidas las lecciones que dejó el día sin IVA, no solo en cuanto a contar con una operación más ordenada y coordinada, bajo la batuta de los alcaldes de cada ciudad y población, sino también adoptar mecanismos para agilizar las compras y las transacciones, el país se alista para la segunda de estas jornadas en el año, que será el próximo viernes 3 de julio. (Le recomendamos: Así puede consultar su saldo para los giros del ingreso solidario)",Los ajustes que traería la segunda jornada sin IVA de este viernes,https://www.eltiempo.com//economia/sectores/dia-sin-iva-medidas-para-evitar-problemas-con-la-segunda-jornada-en-colombia-511920
"Atalanta sigue ganando a ritmo colombiano. Este domingo el equipo italiano se impuso 1-3 al Udinese con goles de Duván Zapata y de Luis Fernando Muriel, este último anotando dos de los goles más bonitos del fin de semana.",Doblete de Muriel: ¡tremendos goles del colombiano con Atalanta!,https://www.eltiempo.com//deportes/futbol-internacional/video-goles-luis-fernando-muriel-en-el-udinese-vs-atalanta-512146
"El jueves pasado, el Departamento Administrativo Nacional de Estadística (Dane) dio a conocer los datos vitales para el primer trimestre del 2020, en un informe que era esperado para saber, entre otras cosas, el exceso de mortalidad en Colombia en medio de la pandemia de covid-19, un indicador vital dentro de las estadísticas de un país.",Muertes por covid serían más que las oficiales en Colombia,https://www.eltiempo.com//salud/coronavirus-cifras-y-datos-de-muertes-sospechosas-por-covid-19-en-colombia-512056
"Jinetes del paraíso es un documental dirigido por Talía Osorio Cardona que presenta, a través de un trabajo de más de una década, la riqueza de los Llanos Orientales al mundo. Su narrador es Cholo Valderrama, un jinete y músico cuya pasión por su tierra lo ha convertido, más que un vocero de esa región, en un rapsoda de la Orinoquia colombiana.","Cholo Valderrama, un jinete del paraíso",https://www.eltiempo.com//cultura/musica-y-libros/entrevista-a-cholo-valderrama-por-alejandro-marin-511788
"Recientemente, Baran Bo Odar y Jantje Friese, los artífices de la serie alemana 'Dark', confesaron que eran pesimistas frente al éxito y alcance de su propuesta televisiva: una aventura paranormal, con narrativa que requería una mayor atención y un historia que no sigue los pasos cómodos para agradar, pero que en este momento es una de las producciones europeas más queridas por el público de la plataforma de Netflix.",La serie de Netflix ‘Dark’ se despide con más oscuridad y complejidad,https://www.eltiempo.com//cultura/cine-y-tv/netflix-y-la-temporada-final-de-dark-la-serie-que-embrujo-al-mundo-511766
"Real Madrid visita al español, partido por la fecha 32 de la Liga de Epaña, en la que es segundo con 68 puntos, a uno del Barcelona. James Rodríguez es suplente. ",EN VIVO: siga el minuto a minuto del partido Español vs. Real Madrid,https://www.eltiempo.com//deportes/futbol-internacional/en-vivo-espanol-vs-real-madrid-fecha-32-de-la-liga-de-espana-512144
Las autoridades dispusieron investigaciones para determinar la procededencia y los móviles de los autores de estas muertes violentas. Hasta ahora no se ha encontrado conexión entre los casos.,En un día fueron asesinadas cuatro mujeres en el Valle del Cauca,https://www.eltiempo.com//colombia/cali/cuatro-sicariatos-de-mujeres-en-el-valle-del-cauca-en-un-dia-511780
"En Asia, China ejercita su músculo, Japón regresa a la arena militar, Corea del Norte está sin líder, India es apabullada por China. Trump y Putin, los dos en trance de reelección, no son instancia confiable para la tranquilidad global, ni siquiera en Venezuela.",,https://www.eltiempo.com//opinion/columnistas/luis-carlos-villegas/rayos-en-asia-truenos-en-america-columna-de-luis-carlos-villegas-511990
"¿Sergio Fajardo, candidato a la presidencia de la República, es un hombre “tibio” como dicen sus oponentes? El exgobernador de Antioquia y exalcalde de Medellín se apresura a responder: “No voy a perder tiempo en peloteras e insultos y ofensas para mostrarme como un valiente”.(Le recomendamos: Supuestos 'hackers' de Anonymous habrían tumbado sitios web de Uribe)",‘El Centro Democrático no va a continuar en el poder’: Sergio Fajardo,https://www.eltiempo.com/politica/partidos-politicos/sergio-fajardo-le-pide-a-alvaro-uribe-que-se-retire-y-habla-de-su-campana-a-la-presidencia-en-2022-511978
"La alcaldesa Claudia López anunció que, como parte de las medidas adoptadas en la ciudad por el aumento de casos de covid-19, se declara la alerta naranja en el Portal Américas de TransMilenio. (Le recomendamos: Claudia López pedirá autorización para declarar cuarentena estricta en Bogotá)",Las tres estaciones de TM que se cerrarán por alto riesgo de contagio,https://www.eltiempo.com//bogota/coronavirus-en-bogota-estaciones-que-se-cerraran-por-riesgo-de-contagio-512050
"Miley Cyrus, Shakira, J Balvin, Coldplay, Justin Bieber, Gustavo Dudamel y una decena de otros artistas participaron este sábado en una transmisión global para urgir a los líderes mundiales el desarrollo y la distribución equitativa ""entre todos y en todas partes"" de tratamientos y vacunas contra el COVID-19.","Shakira, J Balvin y otros piden tratamiento igualitario de covid",https://www.eltiempo.com//cultura/gente/shakira-y-j-balvin-en-el-evento-the-global-goal-unife-for-our-future-512032
"En pleno escándalo del espionaje ilegal por parte de miembros del Ejército, el comandante de esa institución, general Eduardo Enrique Zapateiro, recibió una notificación del delegado para el sector Defensa y Seguridad de la Contraloría General, con fecha del 8 de mayo de 2020.En esta se le notificó a Zapateiro que se acababa de abrir una investigación fiscal por la millonaria reubicación, modernización y ampliación de la planta de combustible, ubicada en el Campo Aéreo de Tolemaida.",Pagaron $16.000 millones por planta para aviación militar que no opera,https://www.eltiempo.com/unidad-investigativa/ejercito-paga-16-000-millones-por-planta-de-combustible-para-aviacion-militar-que-no-esta-operando-512000
"Primero fue Nicolás Maduro y luego, Manuel Cristopher Figuera, general del Ejército venezolano en el exilio. Ambos han dicho que fichas del régimen venezolano tienen infiltrados a miembros de las Fuerzas Armadas de Colombia.Incluso, Jorge Rodríguez, ministro de Comunicaciones del régimen, aseguró que, por esa vía, lograron desarticular la operación de mercenarios contra Maduro (de marzo pasado), bautizada ‘Gedeón’ y calificada por algunos como un fiasco y por otros como un montaje. ",El rastro de Álex Saab en el espionaje venezolano a Colombia,https://www.eltiempo.com//unidad-investigativa/alex-saab-el-rastro-del-espionaje-venezolano-en-colombia-512014
"¿Sergio Fajardo, candidato a la presidencia de la República, es un hombre “tibio” como dicen sus oponentes? El exgobernador de Antioquia y exalcalde de Medellín se apresura a responder: “No voy a perder tiempo en peloteras e insultos y ofensas para mostrarme como un valiente”.(Le recomendamos: Supuestos 'hackers' de Anonymous habrían tumbado sitios web de Uribe)",‘El Centro Democrático no va a continuar en el poder’: Sergio Fajardo,https://www.eltiempo.com//politica/partidos-politicos/sergio-fajardo-le-pide-a-alvaro-uribe-que-se-retire-y-habla-de-su-campana-a-la-presidencia-en-2022-511978
"Primero fue Nicolás Maduro y luego, Manuel Cristopher Figuera, general del Ejército venezolano en el exilio. Ambos han dicho que fichas del régimen venezolano tienen infiltrados a miembros de las Fuerzas Armadas de Colombia.Incluso, Jorge Rodríguez, ministro de Comunicaciones del régimen, aseguró que, por esa vía, lograron desarticular la operación de mercenarios contra Maduro (de marzo pasado), bautizada ‘Gedeón’ y calificada por algunos como un fiasco y por otros como un montaje. ",El rastro de Álex Saab en el espionaje venezolano a Colombia,https://www.eltiempo.com/unidad-investigativa/alex-saab-el-rastro-del-espionaje-venezolano-en-colombia-512014
"El 17 de mayo pasado, por resistirse al hurto de su bicicleta, fue asesinada en Bosa Yenny Cerquera. Tres días después, cuando se estrenaba como domiciliario, le dispararon en el abdomen a Juan Carlos Gálvez por robarle el celular, en Antonio Nariño. El 17 de junio, tres apartamentos de un conjunto residencial fueron robados en Usaquén. Y hubo un asalto de 600 millones de pesos el miércoles pasado a una joyería del centro comercial Gran Estación, en Teusaquillo. Estos son hechos que han puesto en alerta a la ciudadanía y las autoridades. No obstante, en las localidades donde ocurrieron estos casos, y en toda la ciudad, los indicadores delictivos han bajado, a excepción del hurto de bicicletas y la violencia contra las mujeres. ","El rebrote criminal en Bogotá, marcado por golpes grandes",https://www.eltiempo.com//bogota/por-que-ha-aumentado-la-inseguridad-en-bogota-durante-cuarentena-512048
"Les atribuyen, y la inglesa ‘The Economist’ lo recoge, a las fallas del Gobierno mexicano que hoy Latinoamérica sea el centro mundial de la pandemia. Allí están ocupadas más del 90 % de las camas hospitalarias; y el número de muertos registrados se había triplicado a 660 en la primera mitad de junio. ",,https://www.eltiempo.com//opinion/columnistas/maria-isabel-rueda/el-covilexico-columna-de-maria-isabel-rueda-511986
“Las ligas no importan”. Que se lo cuenten a los fans del Liverpool... Los liverpoolianos de cuarenta para abajo bebieron mares y lloraron ríos el jueves por la noche. Llanto de emoción. ¡Qué pandemia ni contagio…! Una vida esperando gritar campeón; por fin se les dio: ¡los Reds son de nuevo los reyes de Inglaterra…! Treinta años después de su última liga,,https://www.eltiempo.com//deportes/futbol-internacional/jorge-barraza-opinion-sobre-el-overpool-y-su-tecnico-juergen-klopp-512002
"El domingo pasado, sobre las cinco de la tarde, una menor de edad de la comunidad embera chamí salió de su casa, en pleno día de mercado, para conseguir unas frutas y no regresó a su vivienda. Al día siguiente fue encontrada sola y llorando cerca del río que pasa por la vereda Santa Cecilia, en el municipio de Pueblo Rico, Risaralda.Una semana después, la menor, que fue violada por un grupo de soldados que prestaban su servicio en el Batallón San Mateo, está bajo protección del Bienestar Familiar en Pereira, parte de su familia tuvo que dejar su casa en Pueblo Rico para acompañarla y apoyarla en la capital del departamento, y siete militares están privados de su libertad en una unidad militar mientras esperan una condena de hasta 30 años de cárcel por su responsabilidad en el atroz hecho.",Las horas claves del caso por violación de niña embera por soldados,https://www.eltiempo.com//justicia/delitos/que-se-sabe-y-que-sigue-en-caso-de-nina-indigena-violada-por-soldados-del-ejercito-511918
"En las últimas semanas hemos recibido varias consultas sobre la situación de los arrendadores y arrendatarios y de las copropiedades después del 30 de junio de 2020.(Lea también: Contracción de la economía será de 5,5 % este año, estima el Gobierno)",Fin de las normas transitorias para la propiedad horizontal,https://www.eltiempo.com//economia/finanzas-personales/normas-para-arrendamiento-y-propiedad-horizontal-a-partir-de-julio-de-2020-en-colombia-511460
"Brasil, el segundo país más afectado en el mundo por la pandemia del coronavirus, apuesta por una solución a largo plazo y de riesgo con el acuerdo anunciado este sábado y que le permitirá producir la vacuna contra la covid-19 que viene siendo experimentada por la Universidad de Oxford.El Ministerio de Salud anunció este sábado haber alcanzado un acuerdo con la Universidad de Oxford y con la farmacéutica AstraZeneca que le permitirá contar con 100 millones de dosis de la vacuna en desarrollo y que, gracias a la transferencia de tecnología, lo habilita a producirla en el país con autonomía. (Le recomendamos: Efectos que posible vacuna contra el covid-19 les causó a voluntarios)",Brasil cierra acuerdo para producir vacuna de Oxford contra covid-19,https://www.eltiempo.com//mundo/latinoamerica/coronavirus-brasil-llega-a-un-acuerdo-con-oxford-para-adquirir-100-millones-de-vacunas-511950
"La Policía Metropolitana de Cali, en una rápida reacción, interceptó el vehículo en el cual estaba siendo transportada una mujer de 40 años en contra de su voluntad por tres hombres.De acuerdo con versiones preliminares, los sujetos habrían amenazado e ingresado a la fuerza al vehículo a la mujer, en la carrera 26 con calle 121, en el oriente de la capital del Valle.(Le recomendamos: En un día fueron asesinadas cuatro mujeres en el Valle del Cauca)",Cae presunta banda de secuestradores de la que hacía parte un policía,https://www.eltiempo.com//colombia/cali/investigan-banda-de-secuestradores-de-la-que-hacia-parte-un-policia-en-cali-511902
"A comienzos de esta semana, El Celler de Can Roca (Girona, España), uno de los restaurantes 'top' del mundo, volvió a abrir sus puertas. Había sido de los primeros de su categoría –tres estrellas Michelin– en cancelar sus reservas y cerrar sus puertas, el 13 de marzo. Su reapertura se dio con expectativa ante los ojos del mundo gastronómico, que teme que la alta cocina se tarde mucho en volver a ser la misma.",Así replantearon su cocina los restaurantes 'top' del mundo,https://www.eltiempo.com//cultura/gastronomia/coronavirus-los-mejores-restaurantes-del-mundo-reabren-con-cambios-512036
"En tiempos donde pareciera que la vida se vuelve monótona, hay quienes nos recuerdan que el mundo vive más de una pandemia, y desde hace siglos. Una tendencia en Twitter hizo que varios usuarios compartieran a las diez mujeres líderes que admiraban y, consideran, están marcando la diferencia en el mundo. En el Reino Unido, el nombre de Sharon Watson se repitió. Además de ser una de las coreógrafas de talla internacional más reconocidas, es un referente en la educación con diversidad.",Diversidad y activismo: las claves de la danzade Sharon Watson,https://www.eltiempo.com//cultura/arte-y-teatro/las-claves-de-la-danza-de-sharon-watson-509254
La asistencia a los cultos religiosos es una de las muchas actividades afectadas por la pandemia del coronavirus que se registra en el país,Eucaristía dominical desde la Catedral de Popayán,https://www.eltiempo.com//vida/religion/eucaristia-domingo-28-de-junio-en-vivo-512080
"“Sé que el mundo se va a acabar / hay que vivir de manera particular. / Ya qué, vive siempre, ama fuerte, yo no sé mañana. / Biutiful, biutiful somos todos”, canta La Ramona en su nueva canción 'Biutiful' en la que el llamado es a entender que la aceptación de la diversidad es la búsqueda real de la igualdad y que hay que vivir la vida, y aun más en estos tiempos de caos. Pero, además, es una canción que marca un antes y un después en la vida de esta joven artista bogotana que conforma la movida de la música independiente colombiana.","La Ramona, cantante bogotana lanza su nueva canción 'Biutiful'",https://www.eltiempo.com//cultura/musica-y-libros/ramona-habla-de-su-nueva-cancion-biutiful-511792
"Desde 2016 se viene hablando de esta alternativa, pero en las últimas semanas el concepto ha tomado mucha fuerza y su eco se escucha en todos los rincones del país. El término ‘catastro’ generalmente está asociado con el cobro de impuestos; sin embargo, va mucho más allá. Es el inventario de los predios y lotes (formales o informales) de un país, y sirve para saber cuántos, dónde y en qué estado se encuentran. ",Tecnología para realizar el Catastro Multipropósito.,https://www.eltiempo.com//contenido-comercial/tecnologia-para-realizar-las-actualizaciones-de-catastro-511576
"La Policía Metropolitana de Cartagena rechazo al comportamiento de los dos uniformados que la noche del sábado provocaron un accidente de tránsito en el barrio Villa Rosita, como consecuencia del estado de alicoramiento en que se encontraban. De acuerdo con el reporte oficial, los funcionarios fueron capturados en flagrancia y recluidos en una celda.",Policías que provocaron accidente en Cartagena deberán pagar daños,https://www.eltiempo.com//colombia/otras-ciudades/policias-implicados-en-accidente-en-cartagena-deberan-pagar-danos-512140
"El pasado 16 de junio, el Ministerio de Salud de Rusia le dio permiso a la Universidad de Sechenov, con sede en Moscú, de probar en humanos su vacuna experimental contra el coronavirus.Dos días después, un grupo de 18 personas recibió las primeras inyecciones de la posible cura. El pasado martes 23 de junio, el fármaco les fue administrado a otros 20 individuos.(Vea: Sugieren que hay un tipo de sangre más propenso a contagios de coronavirus).",Efectos que posible vacuna contra el covid-19 les causó a voluntarios,https://www.eltiempo.com//mundo/europa/covid-19-sintomas-presentados-por-voluntarios-en-vacuna-experimental-511636
"No paran los casos de maltrato infantil en el mundo. Esta vez las autoridades del condado de Henry en Tennessee, EE. UU., hallaron a un pequeño de tan solo 18 meses enjaulado en una perrera de 1.2 metros cuadrados, en medio de sus propias heces, cucarachas, gusanos y roedores. ",Rescatan a niño de 18 meses enjaulado entre cucarachas y roedores,https://www.eltiempo.com//mundo/eeuu-y-canada/rescatan-a-nino-enjaulado-entre-mas-de-600-animales-512070
Lo que se guardó Rudesindo Cantarell Jiménez durante casi una década era la ubicación de uno de los más grandes tesoros energéticos que la naturaleza le dio a México.,El pescador que descubrió el más grande tesoro petrolero de México,https://www.eltiempo.com//economia/sector-financiero/el-pescador-que-descubrio-el-mas-grande-tesoro-petrolero-de-mexico-y-murio-en-el-abandono-512088
"Colombia empieza a ver cómo se duplica el número de muertes diarias. ¿Estamos siquiera cerca del pico de contagio? Además, en este episodio de 'El primer café': Las universidades públicas y privadas del país empiezan a proponer descuentos para evitar la deserción masiva de estudiantes; Gobierno ya habla de reapertura gradual de restaurantes ¿cómo sería? ¿Qué llega a Netflix en julio? Y al final, 'La greca'.",¿Estamos cerca del pico de contagio? / Restaurantes: cómo volver,https://www.eltiempo.com//podcast/el-primer-cafe/pico-de-contagio-y-reapertura-de-restaurantes-temas-de-el-primer-cafe-511396
