body,title,url"Una asamblea de mucha discusión, bastante caliente, como se esperaba, se llevó a cabo este sábado por casi 11 horas, entre los directivos de los 36 equipos del fútbol colombiano, que buscaban definir temas como ratificar el sistema de torneo para la reanudación de los campeonatos de la A y de la B, aclarar el asunto del descenso, además de definir el futuro del contrato de los derechos de la TV internacional.",Al detalle: así fue la larga y 'caliente' asamblea de la Dimayor,https://www.eltiempo.com//deportes/futbol-colombiano/dimayor-conclusiones-de-la-asamblea-para-el-sistema-de-la-liga-betplay-512020
"Estados Unidos atraviesa un momento social que expone no solo el racismo, sino el dominio de la plutocracia y la desigualdad social que vive la clase trabajadora.",El malestar social de la gente común,https://www.eltiempo.com//mundo/eeuu-y-canada/el-malestar-social-de-la-gente-comun-511732
"Aunque en la diligencia de indagatoria -hace tres semanas- María Claudia 'Caya' Daza guardó silencio sobre sus nexos con el oscuro ganadero José 'el Ñeñe' Hernández y los supuestos movimientos de dinero ""por debajo de la mesa"" para la campaña de Iván Duque, este sábado acaba de emitir un comunicado.En este asegura que: ""jamás en mi vida he cometido un acto contrario a la ley, he mantenido siempre un obrar correcto en mi vida familiar, social y pública"". Y sobre Uribe, señala: ""Del expresidente Álvaro Uribe Vélez aprendí el correcto ejercicio de los cargos públicos y el compromiso con la sociedad"". ","'Caya' Daza, clave en la 'Ñeñepolítica', se pronuncia a favor de Uribe",https://www.eltiempo.com//unidad-investigativa/claudia-daza-emite-comunicado-en-apoyo-a-alvaro-uribe-511864
"El pasado 12 de marzo Lina María Arbeláez fue posesionada como la directora del Instituto Colombiano de Bienestar Familiar. A los pocos días se declaraba en el país la emergencia sanitaria, obligando a la entidad a reestructurar en tiempo récord su operación para continuar con la atención de alrededor de 1,7 millones de niños.Pese a que todos los centros de desarrollo infantil, hogares comunitarios y hogares infantiles fueron cerrados para evitar el contagio, la institución continúa prestando sus servicios de alimentación, educación inicial y lucha contra la violencia infantil, todo en condiciones excepcionales provocadas por la pandemia.(Lea también: Menor indígena abusada se encuentra en hogar de paso del ICBF)",‘Jardines infantiles del ICBF seguirán cerrados’,https://www.eltiempo.com//vida/educacion/cuarentena-jardines-infantiles-del-icbf-seguiran-cerrados-511808
"La emergencia que se vive ha dado pie para ver de nuevo historias televisivas que ya son parte del audiovisual colombiano. En tiempos de pandemia y ante la incertidumbre de retomar el trabajo de grabación de series y telenovelas, los canales nacionales han optado por repetir sus producciones más exitosas. Ahora, Caracol retoma 'Rafael Orozco, el ídolo', basada en la vida del músico vallenato, asesinado en junio de 1992.",Alejandro Palacio se reencuentra con su personaje de Rafael Orozco,https://www.eltiempo.com//cultura/cine-y-tv/alejandro-palacio-habla-de-su-papel-en-rafael-orozco-el-idolo-511796
"Luego de la entrevista de James Rodríguez esta semana en la que se sinceró sobre su presente en el Real Madrid, muchos fueron los ecos que tuvieron sus palabras en todo el mundo. En España, aseguran que sus palabras no cayeron bien en la interna de la plantilla del francés Zinedine Zidane.",James deja entrever que se va del Real Madrid y volvió a defenderse,https://www.eltiempo.com//deportes/futbol-internacional/habla-james-rodriguez-de-su-salida-de-real-madrid-y-zinedine-zidane-511868
"Este domingo se celebra el Día Internacional del Orgullo LGBTI como conmemoración de la manifestación que se desató el 28 de junio de 1969 en Nueva York y que marcó el inicio de un movimiento de liberación homosexual.Y aunque este año a causa de la pandemia las festividades preparadas han sido aplazadas, los grupos LBGT realizan desde el sábado en internet un maratón de actividades (Orgullo Global) para visibilizar la lucha por la igualdad de derechos de la comunidad de lesbianas, gais, trasexuales y bisexuales.",La situación de salud y bienestar de la población LGBTI en Colombia,https://www.eltiempo.com//vida/lgbti-informe-sobre-la-situacion-de-la-comunidad-en-colombia-511876
"En pleno escándalo del espionaje ilegal por parte de miembros del Ejército, el comandante de esa institución, general Eduardo Enrique Zapateiro, recibió una notificación del delegado para el sector Defensa y Seguridad de la Contraloría General, con fecha del 8 de mayo de 2020.En esta se le notificó a Zapateiro que se acababa de abrir una investigación fiscal por la millonaria reubicación, modernización y ampliación de la planta de combustible, ubicada en el Campo Aéreo de Tolemaida.",Pagaron $16.000 millones por planta para aviación militar que no opera,https://www.eltiempo.com//unidad-investigativa/ejercito-paga-16-000-millones-por-planta-de-combustible-para-aviacion-militar-que-no-esta-operando-512000
"Un inamovible de la política exterior colombiana desde comienzos del siglo pasado ha sido salvaguardar la buena relación binacional con Estados Unidos. Desde que Marco Fidel Suárez planteó para la política exterior la doctrina ‘respice polum’ (‘Mirar hacia el norte’) en 1918, hemos sido un aliado de primer orden del país del norte en el continente, con la excepción –y con matices– de la administración de Ernesto Samper.",,https://www.eltiempo.com//opinion/editorial/la-estrella-del-norte-editorial-de-el-tiempo-511970
"Con casi 100 días de confinamiento y aislamiento social en el calendario por cuenta de la covid-19, el sindicato de maestros del país, Fecode, quiere sentarse con el Gobierno para formular algunas recomendaciones de cara al segundo semestre de este año.Luisa Fernanda Ospina, secretaria ejecutiva internacional de Fecode, asegura que la agremiación sindical de los maestros quiere un encuentro directo con la Ministra de Educación, pero ha sido imposible que les asignen un espacio en la agenda oficial.(Le recomendamos: Los descuentos anunciados por las principales universidades del país)",Fecode pide al Gobierno garantizar Internet a los alumnos rurales,https://www.eltiempo.com//vida/educacion/coronavirus-colombia-hoy-fecode-pide-al-gobierno-garantizar-internet-a-los-alumnos-rurales-512024
"Infame, no de otra forma puede calificarse un hecho tan brutal como el de la violación de una menor perteneciente a un grupo indígena por 7 soldados en servicio activo.Frente a este escalofriante hecho, nadie puede decir que al conocerlo se ha quedado tranquilo. Esto en razón a que se sale de toda lógica, que los individuos encargados de proteger a la población sean los causantes de una agresión, de la cual la menor difícilmente se repondrá.",El peor de los crímenes / Sexo con Esther,https://www.eltiempo.com//salud/el-peor-de-los-crimenes-columna-de-esther-balac-512026
"El cineasta colombiano Juan David Blanco, realizador audiovisual de EL TIEMPO, propone estos títulos, entre los muchos que están en la plataforma de pago para ver cine, que ofrece ahora ELTIEMPO.COM.",Películas para conmemorar el Día del Orgullo LGBTI,https://www.eltiempo.com//cultura/lgbti-peliculas-para-conmemorar-el-dia-del-orgullo-gay-durante-la-cuarentena-colombia-510730
"En mis largos años de actividad parlamentaria, nunca había visto una legislatura como la que terminó la semana pasada. Y no me refiero solo al funcionamiento del Congreso en modo virtual, que, dicho sea de paso, se le debe en gran medida al presidente de la Cámara de Representantes, doctor Carlos Cuenca, quien terminó imponiéndose frente a muchas voces que de lado y lado se oponían. ",,https://www.eltiempo.com//opinion/columnistas/german-vargas-lleras/una-legislatura-atipica-columna-de-german-vargas-lleras-511972
"El aislamiento preventivo, implementado por el Gobierno Nacional a raíz de la pandemia del nuevo coronavirus, ha tenido un impacto en los hábitos y en el estilo de vida de toda la sociedad. Un cambio brusco que, además de afectar a las personas, puede alterar el comportamiento y la salud de las mascotas. La falta de paseos, juegos en el parque y la modificación de su rutina puede provocar que algunos animales de compañía, como gatos y perros, manifiesten señales de ansiedad, aburrimiento o cambios en su comportamiento.",¿Cómo está afectando la cuarentena a las mascotas?,https://www.eltiempo.com//cultura/gente/cuarentena-efectos-que-puede-tener-en-su-mascota-511040
"El 17 de mayo pasado, por resistirse al hurto de su bicicleta, fue asesinada en Bosa Yenny Cerquera. Tres días después, cuando se estrenaba como domiciliario, le dispararon en el abdomen a Juan Carlos Gálvez por robarle el celular, en Antonio Nariño. El 17 de junio, tres apartamentos de un conjunto residencial fueron robados en Usaquén. Y hubo un asalto de 600 millones de pesos el miércoles pasado a una joyería del centro comercial Gran Estación, en Teusaquillo. Estos son hechos que han puesto en alerta a la ciudadanía y las autoridades. No obstante, en las localidades donde ocurrieron estos casos, y en toda la ciudad, los indicadores delictivos han bajado, a excepción del hurto de bicicletas y la violencia contra las mujeres. ","El rebrote criminal en Bogotá, marcado por golpes grandes",https://www.eltiempo.com/bogota/por-que-ha-aumentado-la-inseguridad-en-bogota-durante-cuarentena-512048
"Un día, unos hombres armados irrumpieron en la tienda de Vicky dispuestos a matar para llevarse el poco dinero producido. El miedo a la extorsión es cotidiano en Tumaco, feudo de narcotraficantes y una de las localidades más peligrosas de Colombia. ","La extorsión, el regreso de un miedo cotidiano en Tumaco",https://www.eltiempo.com//justicia/la-extorsion-vuelve-a-tomarse-tumaco-511908
"En los próximos minutos el comando de la Policía de Cartagena estará entregando un comunicado oficial, en el que explica la situación de los dos agentes de la institución, que según denuncias de la comunidad, estaban bajos efectos del alcohol y provocaron un accidente de tránsito en la noche del sábado.",Denuncian en Cartagena a Policías que habrían provocado accidente,https://www.eltiempo.com//colombia/otras-ciudades/video-denuncian-en-cartagena-a-dos-policias-que-provocaron-accidente-512092
La alcaldesa de Bogotá Claudia López anunció a través de una rueda de prensa nuevas medidas para mitigar los contagios por la covid-19 en Bogotá. Este lunes radicará ante el Ministerio del Interior un documento que contiene las propuestas para frenar los casos de la enfermedad. La alcaldesa pide el retorno de una cuarentena estricta. (Le recomendamos: Colombia se acerca a las tres mil muertes por coronavirus),Claudia López le pide al Presidente que vuelva la cuarentena estricta,https://www.eltiempo.com//bogota/coronavirus-en-bogota-claudia-lopez-anuncia-nuevas-medidas-en-bogota-por-casos-de-covid-19-512018
"‘Viajar para inspirar’, este fue el nombre que Alejandro Turbay Noguera, un bogotano de 41 años, le puso al proyecto que nació el 3 de marzo de 2015, cuando se subió a un avión con destino a Manila (Filipinas), donde comenzaría su viaje de cuatro años para recorrer Asia, Oriente Medio y África, en bicicleta, tren, avión, bus y hasta caminando.Alejandro creció en Nueva York rodeado del mundo comercial, rápido y consumista; a los 18 años entró a estudiar comunicaciones, dice que eligió eso porque “no tenía la valentía para ser artista”.",El bogotano que recorrió 29 países con 9 euros al día,https://www.eltiempo.com//bogota/historia-del-bogotano-que-recorrio-29-paises-con-9-euros-al-dia-511942
"Entre los varios anuncios que el jueves en la noche se hicieron en materia de seguridad, hubo una alusión del viceministro de Defensa, Jairo García, que me dejó atónito. Según el funcionario, las organizaciones criminales llevan dos meses de receso y están ansiosas de regresar a sus fechorías para ‘cuadrar caja’, por lo que –imagino– se vuelven más osadas y desafiantes. Fue lo que vimos en el asalto al edificio residencial de Usaquén o a la joyería de un centro comercial. Verdaderos comandos armados sin temor a nada ni a nadie.(Le recomendamos: Claudia López pedirá autorización para declarar cuarentena estricta en Bogotá)","La nueva seguridad, según la alcaldesa / Voy y vuelvo",https://www.eltiempo.com//bogota/la-nueva-seguridad-segun-la-alcaldesa-voy-y-vuelvo-columna-de-ernesto-cortes-511946
